nom,women,men,hiver,printemps,ete,autone,jour,nuit,marine,savory,earthy,anis,rubber,lactonic,fruity,ozonic,rum,sand,fresh spicy,salty,metallic,cherry,violet,cacao,soapy,coca-cola,chocolate,citrus,lavender,soft spicy,mossy,gasoline,aromatic,whiskey,oud,powdery,white floral,iris,almond,conifer,beeswax,cinnamon,nan,plastic,camphor,honey,Champagne,patchouli,warm spicy,fresh,sour,tobacco,vodka,mineral,smoky,rose,green,coconut,coffee,sweet,tuberose,animalic,herbal,vanilla,bitter,woody,cannabis,caramel,tropical,amber,nutty,musky,aldehydic,leather,terpenic,aquatic,balsamic,floral,yellow floral
A Nocturnal Whisper Perfume Oil Gucci for women and men,1.0,1.0,1.0,0.0,0.0,1.0,1.0,1.0,0,0,0,0,0,0,0,0,0,0,0,0,1,0,0,0,0,0,0,0,0,0,0,0,0,0,1,0,0,0,0,0,0,0,0,0,0,0,0,0,1,0,0,1,0,0,1,0,0,0,0,0,0,1,0,1,0,0,0,0,0,1,0,0,0,1,0,0,0,0,0
A Reason To Love Gucci for women and men,1.0,1.0,1.0,1.0,0.0,1.0,0.0,1.0,0,0,0,0,0,0,0,0,0,0,0,0,0,0,0,0,0,0,0,0,0,0,0,0,0,0,1,1,0,0,0,0,0,0,0,0,0,0,0,0,1,1,0,0,0,0,0,1,0,0,0,0,0,0,0,0,0,0,0,0,0,1,0,0,0,0,0,0,0,1,0
A Song For The Rose Eau de Parfum Gucci for women and men,1.0,1.0,1.0,1.0,1.0,1.0,1.0,1.0,0,0,0,0,0,0,0,0,0,0,0,0,0,0,0,0,0,0,0,0,0,0,0,0,0,0,0,1,0,0,0,0,0,0,0,0,0,0,0,0,0,0,0,0,0,0,0,1,0,0,0,0,0,0,0,0,0,1,0,0,0,0,0,1,0,0,0,0,0,1,0
A Winter Melody Scented Water Gucci for women and men,1.0,1.0,1.0,1.0,0.0,1.0,1.0,1.0,0,0,0,0,0,0,0,0,0,0,1,0,0,0,0,0,0,0,0,1,0,0,0,0,1,0,0,0,0,0,0,0,0,0,0,0,0,0,0,0,0,0,0,0,0,0,0,1,0,0,0,0,0,0,0,0,0,1,0,0,0,0,0,0,0,0,0,0,0,0,0
Bloom Gocce di Fiori Gucci for women,1.0,0.0,0.0,1.0,1.0,0.0,1.0,0.0,0,0,0,0,0,0,1,0,0,0,0,0,0,0,0,0,0,0,0,0,0,0,0,0,0,0,0,0,1,0,0,0,0,0,0,0,0,0,0,0,0,0,0,0,0,0,0,0,0,0,0,0,1,0,0,0,0,0,0,0,0,0,0,0,0,0,0,0,0,0,0
Fading Autumn Scented Water Gucci for women and men,1.0,1.0,1.0,1.0,0.0,1.0,1.0,1.0,0,0,1,0,0,0,0,0,0,0,0,0,0,0,0,0,0,0,0,0,0,0,0,0,0,0,0,1,0,0,0,0,0,0,0,0,0,0,0,1,1,0,0,0,0,0,0,0,0,0,0,0,0,0,0,0,0,1,0,0,0,0,0,0,0,0,0,0,0,0,0
Flora Gorgeous Jasmine Gucci for women,1.0,0.0,0.0,1.0,1.0,0.0,1.0,0.0,0,0,0,0,0,0,0,0,0,0,1,0,0,0,0,0,0,0,0,1,0,0,0,0,0,0,0,0,1,0,0,0,0,0,0,0,0,0,0,0,1,0,0,0,0,0,0,0,0,0,0,0,0,0,0,0,0,1,0,0,0,1,0,0,0,0,0,0,0,1,0
Gucci Bloom Gucci for women,1.0,0.0,0.0,1.0,1.0,0.0,1.0,0.0,0,0,0,0,0,0,0,0,0,0,0,0,0,0,0,0,0,0,0,0,0,0,0,0,0,0,0,0,1,0,0,0,0,0,0,0,0,0,0,0,0,0,0,0,0,0,0,0,0,0,0,0,1,0,0,0,0,0,0,0,0,0,0,0,0,0,0,0,0,0,0
Gucci Bloom Acqua di Fiori Gucci for women,1.0,0.0,0.0,1.0,1.0,0.0,1.0,0.0,0,0,0,0,0,0,1,0,0,0,0,0,0,0,0,0,0,0,0,0,0,1,0,0,1,0,0,0,1,0,0,0,0,0,0,0,0,0,0,0,0,1,0,0,0,0,0,0,1,0,0,0,1,0,0,0,0,1,0,0,0,0,0,1,0,0,0,0,0,1,0
Gucci Bloom Ambrosia di Fiori Gucci for women,1.0,0.0,1.0,1.0,1.0,1.0,1.0,1.0,0,0,0,0,0,0,0,0,0,0,0,0,0,0,0,0,0,0,0,0,0,0,0,0,0,0,0,0,1,0,0,0,0,0,0,0,0,0,0,0,0,0,0,0,0,0,0,1,0,0,0,0,1,0,0,0,0,0,0,0,0,0,0,0,0,0,0,0,0,0,0
Gucci Bloom Hair Mist Gucci for women,1.0,0.0,0.0,1.0,1.0,1.0,1.0,1.0,0,0,0,0,0,0,0,0,0,0,0,0,0,0,0,0,0,0,0,1,0,0,0,0,0,0,0,1,1,1,0,0,0,0,0,0,0,0,0,0,0,0,0,0,0,0,0,0,1,0,0,0,1,0,0,1,0,1,0,0,0,0,0,0,0,0,0,0,0,0,0
Gucci Bloom Intense Gucci for women,1.0,0.0,1.0,1.0,1.0,1.0,1.0,1.0,0,0,1,0,0,0,1,0,0,0,0,0,0,0,0,0,0,0,0,0,0,0,1,0,0,0,0,0,1,0,0,0,0,0,0,0,0,0,0,1,1,0,0,0,0,0,0,0,0,0,0,1,1,0,0,0,0,0,0,0,0,0,0,0,0,0,0,0,0,0,0
Gucci Bloom Nettare Di Fiori Gucci for women,1.0,0.0,0.0,1.0,1.0,1.0,1.0,0.0,0,0,0,0,0,0,1,0,0,0,0,0,0,0,0,0,0,0,0,0,0,0,0,0,0,0,0,0,1,0,0,0,0,0,0,0,0,0,0,0,1,0,0,0,0,0,0,0,0,0,0,0,1,1,0,0,0,0,0,0,0,0,0,1,0,0,0,0,0,1,0
Gucci Bloom Profumo Di Fiori Gucci for women,1.0,0.0,0.0,1.0,1.0,1.0,1.0,0.0,0,0,0,0,0,0,0,0,0,0,0,0,0,0,0,0,0,0,0,0,0,0,0,0,0,0,0,1,1,0,0,0,0,0,0,0,0,0,0,0,0,0,0,0,0,0,0,0,0,0,0,1,1,1,0,0,0,1,0,0,0,0,0,1,0,0,0,0,0,1,1
Gucci Garden Gucci for women and men,1.0,1.0,1.0,1.0,1.0,1.0,1.0,1.0,0,0,0,0,0,0,0,0,0,0,0,0,0,0,1,0,0,0,0,1,0,0,0,0,1,0,0,1,0,0,0,0,0,0,0,0,0,1,0,0,0,0,0,0,0,0,0,0,0,0,0,1,0,0,1,0,0,1,0,0,0,0,0,0,0,0,0,0,0,1,1
Gucci Guilty Absolute Gucci for men,0.0,1.0,1.0,0.0,0.0,1.0,1.0,1.0,0,0,1,0,0,0,0,0,0,0,0,0,0,0,0,0,0,0,0,0,0,0,0,0,1,0,0,0,0,0,0,0,0,0,0,0,0,0,0,1,0,0,0,0,0,0,1,0,0,0,0,0,0,1,0,0,0,1,0,0,0,0,0,0,0,1,0,0,0,0,0
Gucci Guilty Absolute pour Femme Gucci for women,1.0,0.0,1.0,1.0,0.0,1.0,1.0,1.0,0,0,1,0,0,0,1,0,0,0,1,0,0,0,0,0,0,0,0,0,0,0,0,0,1,0,0,0,0,0,0,0,0,0,0,0,0,0,0,1,0,0,0,0,0,0,0,1,0,0,0,1,0,0,0,0,0,1,0,0,0,0,0,0,0,0,0,0,0,0,0
Gucci Guilty Cologne pour Homme Gucci for men,0.0,1.0,0.0,1.0,1.0,0.0,1.0,0.0,0,0,0,0,0,0,0,0,0,0,1,0,0,0,1,0,0,0,0,1,0,0,0,0,1,0,0,1,0,0,0,0,0,0,0,0,0,0,0,0,0,0,0,0,0,0,0,0,0,0,0,0,0,0,0,0,0,1,0,0,0,0,0,1,0,0,0,0,0,0,0
Gucci Guilty Love Edition Pour Femme Gucci for women,1.0,0.0,0.0,1.0,1.0,0.0,1.0,0.0,0,0,0,0,0,0,1,0,0,0,0,0,0,0,1,0,0,0,0,1,0,0,0,0,0,0,0,1,0,0,0,0,0,0,0,0,0,0,0,0,0,1,0,0,0,0,0,0,0,0,0,1,0,0,0,0,0,1,0,0,0,0,0,1,0,0,0,1,0,1,0
Gucci Guilty Love Edition Pour Homme Gucci for men,0.0,1.0,0.0,1.0,1.0,0.0,1.0,0.0,0,0,1,0,0,0,0,0,0,0,1,0,0,0,0,0,0,0,0,1,1,0,0,0,1,0,0,0,0,0,0,0,0,0,0,0,0,0,0,0,1,1,0,0,0,0,0,0,0,0,0,0,0,0,1,0,0,1,0,0,0,0,0,0,0,0,0,0,0,0,0
Gucci Guilty Oud Gucci for women and men,1.0,1.0,1.0,0.0,0.0,1.0,0.0,1.0,0,0,1,0,0,0,1,0,0,0,0,0,0,0,0,0,0,0,0,0,0,0,0,0,0,0,1,0,0,0,0,0,0,0,0,0,0,0,0,1,0,0,0,0,0,0,0,1,0,0,0,1,0,1,0,0,0,1,0,0,0,1,0,0,0,1,0,0,0,0,0
Guilty Love Edition MMXXI pour Femme Gucci for women,1.0,0.0,0.0,1.0,1.0,0.0,1.0,0.0,0,0,0,0,0,0,0,0,0,0,1,0,0,0,1,0,0,0,0,1,0,1,0,0,1,0,0,1,0,0,0,0,0,0,0,0,0,0,0,1,0,1,0,0,0,0,0,0,0,0,0,0,0,0,0,0,0,1,0,0,0,0,0,0,0,0,0,0,0,1,0
Guilty Love Edition MMXXI pour Homme Gucci for men,0.0,1.0,0.0,1.0,1.0,1.0,1.0,0.0,0,0,0,0,0,0,0,0,0,0,1,0,0,0,0,0,0,0,0,1,1,0,0,0,1,0,0,0,1,0,0,0,0,0,0,0,0,1,0,1,0,0,0,0,0,0,0,0,0,0,0,1,0,0,0,0,0,1,0,0,0,0,0,0,0,0,0,0,0,1,0
Hortus Sanitatis Gucci for women and men,1.0,1.0,1.0,1.0,0.0,1.0,1.0,1.0,0,0,1,0,0,0,0,0,0,0,0,0,0,0,0,0,0,0,0,0,0,0,0,0,1,0,0,0,0,0,0,0,0,0,0,0,0,0,0,0,1,0,0,0,0,0,0,0,1,0,0,0,0,0,0,0,0,1,0,0,0,0,0,0,0,0,0,0,0,0,0
Love At Your Darkest Gucci for women and men,1.0,1.0,1.0,1.0,0.0,1.0,1.0,1.0,0,0,0,0,0,0,0,0,0,0,1,0,0,0,0,0,0,0,0,0,0,0,0,0,1,0,0,0,0,0,0,0,0,0,0,0,0,0,0,0,1,0,0,0,0,0,0,0,0,0,0,0,0,0,0,0,0,1,0,0,0,1,0,0,0,0,0,0,0,0,0
Mémoire d’une Odeur Gucci for women and men,1.0,1.0,0.0,1.0,1.0,1.0,1.0,0.0,0,0,0,0,0,0,0,0,0,0,0,0,0,0,0,0,0,0,0,0,0,0,0,0,1,0,0,1,1,0,1,0,0,0,0,0,0,0,0,0,0,0,0,0,0,0,0,0,0,0,0,1,0,0,1,0,0,1,0,0,0,0,1,1,0,0,0,0,0,1,0
Moonlight Serenade Scented Water Gucci for women and men,1.0,1.0,0.0,1.0,1.0,1.0,1.0,1.0,0,0,0,0,0,0,0,0,0,0,1,0,0,0,0,0,0,0,0,0,1,1,0,0,1,0,0,0,0,0,0,0,0,0,0,0,0,0,0,0,0,0,0,0,0,0,0,0,0,0,0,0,0,0,1,0,0,0,0,0,0,0,0,0,0,0,0,0,0,0,0
Ode on Melancholy Perfume Oil Gucci for women and men,1.0,1.0,1.0,1.0,0.0,1.0,1.0,1.0,0,0,1,0,0,0,0,0,0,0,0,0,0,0,0,0,0,0,0,0,0,0,0,0,0,0,0,1,0,0,0,0,0,0,0,0,0,0,0,0,0,0,0,0,0,0,0,0,0,0,0,0,0,0,0,0,0,1,0,0,0,0,0,0,0,0,0,0,0,0,0
Tears From The Moon Gucci for women and men,1.0,1.0,0.0,1.0,1.0,0.0,1.0,0.0,0,0,0,0,0,0,0,0,0,0,0,0,0,0,0,0,0,0,0,0,0,0,0,0,0,0,0,0,1,0,0,0,0,0,0,0,0,0,0,0,0,1,0,0,0,0,0,1,1,0,0,0,0,0,0,0,0,0,0,0,0,0,0,0,0,0,0,0,0,1,0
Tears Of Iris Eau de Parfum Gucci for women and men,1.0,1.0,0.0,1.0,0.0,1.0,1.0,0.0,0,0,1,0,0,0,0,0,0,0,0,0,0,0,1,0,0,0,0,0,0,0,0,0,0,0,0,1,0,1,0,0,0,0,0,0,0,0,0,0,0,0,0,0,0,0,0,0,0,0,0,0,0,0,0,0,0,1,0,0,0,1,0,1,0,0,0,0,0,0,0
The Eyes Of The Tiger Eau de Parfum Gucci for women and men,1.0,1.0,1.0,0.0,0.0,1.0,1.0,1.0,0,0,0,0,0,0,0,0,0,0,0,0,0,0,0,0,0,0,0,0,0,0,0,0,0,0,0,1,0,0,0,0,0,0,0,0,0,0,0,0,0,0,0,0,0,0,0,0,0,0,0,0,0,0,0,1,0,0,0,0,0,1,0,0,0,0,0,0,0,0,0
The Last Day Of Summer Eau de Parfum Gucci for women and men,1.0,1.0,1.0,1.0,0.0,1.0,1.0,1.0,0,0,1,0,0,0,0,0,0,0,1,0,0,0,0,0,0,0,0,0,0,0,0,0,1,0,0,0,0,0,0,0,0,0,0,0,0,0,0,1,0,0,0,0,0,0,0,0,0,0,0,0,0,0,0,0,0,1,0,0,0,0,0,0,0,0,0,0,0,0,0
The Virgin Violet Eau de Parfum Gucci for women and men,1.0,1.0,1.0,1.0,1.0,1.0,1.0,1.0,0,0,0,0,0,0,0,0,0,0,0,0,0,0,1,0,0,0,0,0,0,0,0,0,0,0,0,1,0,1,0,0,0,0,0,0,0,0,0,0,0,0,0,0,0,0,0,0,0,0,0,0,0,0,0,1,0,0,0,0,0,0,0,1,0,0,0,0,0,1,0
The Voice Of The Snake Eau de Parfum Gucci for women and men,1.0,1.0,1.0,0.0,0.0,1.0,0.0,1.0,0,0,1,0,0,0,0,0,0,0,0,0,1,0,0,0,0,0,0,0,0,0,0,0,0,0,1,0,0,0,0,0,0,0,0,0,0,0,0,1,1,0,0,1,0,0,0,0,0,0,0,0,0,0,0,0,0,1,0,0,0,0,0,0,0,1,0,0,0,0,0
Winter's Spring Eau de Parfum Gucci for women and men,1.0,1.0,0.0,1.0,0.0,0.0,1.0,0.0,0,0,0,0,0,0,0,0,0,0,1,0,0,0,0,0,0,0,0,0,0,0,0,0,0,0,0,1,0,0,0,0,0,0,0,0,0,0,0,0,0,0,0,0,0,0,0,0,0,0,0,1,0,0,0,0,0,0,0,0,0,0,0,1,0,0,0,0,0,1,1
Herve Leger Herve Leger for women,1.0,0.0,1.0,1.0,0.0,1.0,1.0,1.0,0,0,0,0,0,1,1,0,0,0,0,0,0,0,0,0,0,0,0,0,0,1,0,0,0,0,0,1,0,0,0,0,0,0,0,0,0,0,0,0,0,0,0,0,0,0,0,0,0,0,0,1,0,0,0,1,0,1,0,0,0,1,0,1,0,0,0,0,0,1,0
Ines de la Fressange 2004 Ines de la Fressange for women,1.0,0.0,0.0,1.0,0.0,1.0,1.0,0.0,0,0,0,0,0,0,1,0,0,0,0,0,0,0,0,0,0,0,0,1,0,0,0,0,1,0,0,0,1,0,0,0,0,0,0,0,0,0,0,0,0,1,0,0,0,0,0,1,1,0,0,0,0,0,0,0,0,1,0,0,0,0,0,1,0,0,0,0,0,1,0
J'ai Trois Amours Infiniment Coty Paris for women and men,1.0,1.0,1.0,1.0,1.0,1.0,1.0,1.0,0,0,0,0,0,0,1,0,0,0,0,0,0,0,0,0,0,0,0,0,0,0,0,0,0,0,0,0,1,0,0,0,0,0,0,0,0,0,0,0,0,0,0,0,0,0,0,0,1,0,0,0,0,0,0,0,0,0,0,0,0,0,0,0,0,0,0,0,0,1,0
Blessed Baraka Initio Parfums Prives for women and men,1.0,1.0,1.0,0.0,0.0,1.0,1.0,1.0,0,0,0,0,0,0,0,0,0,0,0,0,0,0,0,0,0,0,0,0,0,0,0,0,0,0,0,1,0,0,0,0,0,0,0,0,0,0,0,0,1,0,0,0,0,0,0,0,0,0,0,0,0,1,0,0,0,1,0,0,0,1,0,1,0,0,0,0,0,0,0
Manifesto Isabella Rossellini for women,1.0,0.0,0.0,1.0,1.0,0.0,1.0,0.0,0,0,0,0,0,0,0,0,0,0,1,0,0,0,0,0,0,0,0,1,0,0,0,0,1,0,0,0,1,0,0,0,0,0,0,0,0,0,0,0,0,0,0,0,0,0,0,0,1,0,0,0,0,0,1,0,0,0,0,0,0,0,0,0,0,0,0,0,0,0,0
L'Eau d'Issey City Blossom Issey Miyake for women,1.0,0.0,0.0,1.0,1.0,0.0,1.0,0.0,0,0,0,0,0,0,0,1,0,0,0,0,0,0,0,0,0,0,0,1,0,1,0,0,0,0,0,0,1,0,0,0,0,0,0,0,0,0,0,0,0,1,0,0,0,0,0,1,0,0,0,0,0,0,0,0,0,1,0,0,0,0,0,1,0,0,0,0,0,1,0
L'Eau d'Issey Florale Issey Miyake for women,1.0,0.0,0.0,1.0,1.0,0.0,1.0,0.0,0,0,0,0,0,0,0,0,0,0,0,0,0,0,0,0,0,0,0,1,0,1,0,0,0,0,0,0,1,0,0,0,0,0,0,0,0,0,0,0,0,0,0,0,0,0,0,1,0,0,0,0,0,0,0,0,0,1,0,0,0,0,0,0,0,0,0,0,0,1,0
L'Eau d'Issey pour Homme Oceanic Expedition Issey Miyake for men,0.0,1.0,0.0,1.0,1.0,0.0,1.0,0.0,1,0,0,0,0,0,0,0,0,0,1,0,0,0,0,0,0,0,0,1,0,0,0,0,1,0,0,0,0,0,0,0,0,0,0,0,0,0,0,0,1,0,0,0,0,0,0,0,0,0,0,0,0,0,0,0,0,0,0,0,0,0,0,0,0,0,0,0,0,0,0
L'Eau d'Issey Pour Homme Summer 2013 Issey Miyake for men,0.0,1.0,0.0,1.0,1.0,0.0,1.0,0.0,0,0,1,0,0,0,1,0,0,0,1,0,0,0,0,0,0,0,0,1,0,0,0,0,1,0,0,0,0,0,0,0,0,0,0,0,0,0,0,0,0,1,0,0,0,0,0,0,0,0,0,1,0,0,0,0,0,1,0,0,1,0,0,0,0,0,0,0,0,0,0
L'Eau d'Issey Pour Homme Summer 2016 Issey Miyake for men,0.0,1.0,0.0,1.0,1.0,0.0,1.0,0.0,0,0,1,0,0,0,1,0,0,0,1,0,0,0,0,0,0,0,0,1,0,0,0,0,1,0,0,0,0,0,0,0,0,0,0,0,0,0,0,0,0,1,0,0,0,0,0,0,0,0,0,1,0,0,0,0,0,1,0,0,1,0,0,0,0,0,0,0,0,0,0
L'Eau d'Issey Pour Homme Summer 2017 Issey Miyake for men,0.0,1.0,0.0,1.0,1.0,0.0,1.0,0.0,0,0,1,0,0,0,1,0,0,0,1,0,0,0,0,0,0,0,0,1,0,0,0,0,1,0,0,0,0,0,0,0,0,0,0,0,0,0,0,0,0,1,0,0,0,0,0,0,0,0,0,1,0,0,0,0,0,1,0,0,1,0,0,0,0,0,0,0,0,0,0
L'Eau d'Issey Pour Homme Summer 2018 Issey Miyake for men,0.0,1.0,0.0,1.0,1.0,0.0,1.0,0.0,0,0,1,0,0,0,1,0,0,0,1,0,0,0,0,0,0,0,0,1,0,0,0,0,1,0,0,0,0,0,0,0,0,0,0,0,0,0,0,0,0,1,0,0,0,0,0,0,0,0,0,1,0,0,0,0,0,1,0,0,1,0,0,0,0,0,0,0,0,0,0
L'Eau d'Issey Reflection In A Drop Issey Miyake for women,1.0,0.0,0.0,1.0,1.0,0.0,1.0,0.0,0,0,0,0,0,0,0,1,0,0,0,0,0,0,0,0,0,0,0,1,0,0,0,0,0,0,0,1,0,0,0,0,0,0,0,0,0,0,0,0,0,0,0,0,0,0,0,1,0,0,0,1,0,0,0,0,0,0,0,0,0,0,0,1,0,0,0,1,0,1,0
L'Eau d'Issey Summer 2013 Issey Miyake for women,1.0,0.0,0.0,0.0,1.0,0.0,1.0,0.0,0,0,0,0,0,0,1,0,0,0,0,0,0,0,0,0,0,0,0,1,0,0,0,0,0,0,0,0,0,0,0,0,0,0,0,0,0,0,0,0,0,1,0,0,0,0,0,0,0,0,0,1,0,0,0,0,0,1,0,0,1,0,0,0,0,0,0,0,0,1,0
L'Eau d'Issey Summer 2016 Issey Miyake for women,1.0,0.0,0.0,1.0,1.0,0.0,1.0,0.0,0,0,0,0,0,0,1,0,0,0,1,0,0,0,0,0,0,0,0,1,0,0,0,0,0,0,0,0,0,0,0,0,0,0,0,0,0,0,0,0,0,1,0,0,0,0,0,0,0,0,0,0,0,0,0,1,0,1,0,0,1,0,0,0,0,0,0,0,0,0,0
L'Eau d'Issey Summer 2017 Issey Miyake for women,1.0,0.0,0.0,0.0,1.0,0.0,1.0,0.0,0,0,0,0,0,0,1,0,0,0,0,0,0,0,0,0,0,0,0,1,0,0,0,0,0,0,0,0,0,0,0,0,0,0,0,0,0,0,0,0,0,1,0,0,0,0,0,0,0,0,0,0,0,0,0,0,0,0,0,0,1,0,0,0,0,0,0,1,0,1,0
L'Eau d'Issey Summer 2018 Issey Miyake for women,1.0,0.0,0.0,0.0,1.0,0.0,1.0,0.0,0,0,0,0,0,0,1,0,0,0,0,0,0,0,0,0,0,0,0,1,0,0,0,0,0,0,0,0,0,0,0,0,0,0,0,0,0,0,0,0,0,1,0,0,0,0,0,0,0,0,0,1,0,0,0,1,0,1,0,0,1,0,0,0,0,0,0,0,0,0,0
L'Eau D'Issey Une goutte sur un Petale Issey Miyake for women,1.0,0.0,0.0,1.0,1.0,0.0,1.0,0.0,0,0,0,0,0,0,0,0,0,0,0,0,0,0,0,0,0,0,0,1,0,0,0,0,0,0,0,1,0,0,0,0,0,0,0,0,0,0,0,0,0,0,0,0,0,0,0,1,0,0,0,1,0,0,0,0,0,1,0,0,0,0,0,1,0,0,0,0,0,0,0
L'Eau d’Issey Lotus Issey Miyake for women,1.0,0.0,0.0,1.0,1.0,0.0,1.0,0.0,0,0,0,0,0,0,0,1,0,0,1,0,0,0,0,0,0,0,0,0,0,0,0,0,0,0,0,0,1,0,0,0,0,0,0,0,0,0,0,0,0,1,0,0,0,0,0,0,1,0,0,0,0,0,0,0,0,1,0,0,0,0,0,1,0,0,0,1,0,1,0
L’Eau d’Issey Pour Homme Sport Mint Issey Miyake for men,0.0,1.0,0.0,1.0,1.0,0.0,1.0,0.0,0,0,1,0,0,0,0,0,0,0,1,0,0,0,0,0,0,0,0,1,0,0,0,0,1,0,0,0,0,0,0,0,0,0,0,0,0,0,0,0,0,0,0,0,0,0,0,0,1,0,0,0,0,0,0,0,0,1,0,0,0,0,0,0,0,0,0,0,0,0,0
Esencia de Duende Jesus Del Pozo for women,1.0,0.0,0.0,1.0,1.0,0.0,1.0,0.0,0,0,0,0,0,0,0,0,0,0,1,0,0,0,0,0,0,0,0,1,0,0,0,0,1,0,0,0,1,0,0,0,0,0,0,0,0,0,0,0,0,0,0,0,0,0,0,1,1,0,0,0,0,0,0,0,0,1,0,0,0,0,0,0,0,0,0,0,0,1,0
Flower by Kenzo Kenzo for women,1.0,0.0,1.0,1.0,0.0,1.0,1.0,0.0,0,0,0,0,0,0,0,0,0,0,0,0,0,0,1,0,0,0,0,0,0,0,0,0,0,0,0,1,0,0,0,0,0,0,0,0,0,0,0,0,0,0,0,0,0,0,0,1,0,0,0,1,0,0,0,1,0,1,0,0,0,1,0,1,0,0,0,0,1,1,0
Flower by Kenzo 20th Anniversary Edition Kenzo for women,1.0,0.0,1.0,1.0,0.0,1.0,1.0,1.0,0,0,0,0,0,0,1,0,0,0,0,0,0,0,1,0,0,0,0,0,0,1,0,0,1,0,0,1,0,0,0,0,0,0,0,0,0,0,0,0,0,0,0,0,0,0,0,1,1,0,0,0,0,0,0,1,0,0,0,0,0,0,0,1,0,0,0,0,0,1,0
Flower by Kenzo Eau de Lumière Kenzo for women,1.0,0.0,0.0,1.0,1.0,1.0,1.0,0.0,0,0,0,0,0,0,1,0,0,0,0,0,0,0,1,0,0,0,0,1,0,0,0,0,0,0,0,1,1,0,0,0,0,0,0,0,0,0,0,0,0,0,0,0,0,0,0,1,0,0,0,0,0,0,0,1,0,1,0,0,0,0,0,1,0,0,0,0,0,1,0
Flower by Kenzo Eau de Toilette (2021) Kenzo for women,1.0,0.0,0.0,1.0,1.0,0.0,1.0,0.0,0,0,0,0,0,0,0,0,0,0,0,0,0,0,0,0,0,0,0,1,0,0,0,0,1,0,0,1,0,0,0,0,0,0,0,0,0,0,0,0,0,0,0,0,0,0,0,1,0,0,0,1,0,0,1,1,0,0,0,0,0,0,0,1,0,0,0,0,0,1,1
Flower by Kenzo Eau de Vie Kenzo for women,1.0,0.0,0.0,1.0,1.0,1.0,1.0,0.0,0,0,0,0,0,0,0,0,0,0,0,0,0,0,0,0,0,0,0,1,0,0,0,0,1,0,0,1,1,0,0,0,0,0,0,0,0,0,0,0,1,1,0,0,0,0,0,0,0,0,0,1,0,0,0,1,0,0,0,0,0,1,0,1,0,0,0,0,0,0,0
Flower by Kenzo Eau Florale Kenzo for women,1.0,0.0,0.0,1.0,1.0,0.0,1.0,0.0,0,0,0,0,0,0,0,0,0,0,0,0,0,0,0,0,0,0,0,1,0,0,0,0,0,0,0,1,0,0,0,0,0,0,0,0,0,0,0,0,0,1,0,0,0,0,0,1,0,0,0,0,0,0,0,1,0,0,0,0,0,0,0,1,0,0,0,0,0,1,0
Flower by Kenzo Edition d'Artistes Kenzo for women,1.0,0.0,1.0,1.0,0.0,1.0,1.0,1.0,0,0,0,0,0,0,0,0,0,0,0,0,0,0,1,0,0,0,0,0,0,0,0,0,0,0,0,1,0,0,0,0,0,0,0,0,0,0,0,0,0,1,0,0,0,0,0,1,0,0,0,1,0,0,0,1,0,1,0,0,0,1,0,1,0,0,0,0,0,1,0
Flower by Kenzo Essentielle Kenzo for women,1.0,0.0,1.0,1.0,0.0,1.0,1.0,0.0,0,0,0,0,0,0,0,0,0,0,1,0,0,0,0,0,0,0,0,0,0,0,0,0,0,0,0,1,0,0,0,0,0,0,0,0,0,0,0,0,1,0,0,0,0,0,1,1,0,0,0,0,0,0,0,1,0,0,0,0,0,1,0,1,0,0,0,0,1,1,0
Flower by Kenzo L'Absolue Kenzo for women,1.0,0.0,1.0,1.0,0.0,1.0,1.0,1.0,0,0,0,0,0,0,0,0,0,0,0,0,1,0,0,0,0,0,0,1,0,0,0,0,0,0,0,1,1,0,0,0,0,0,0,0,0,0,0,0,1,0,0,0,0,0,0,1,0,0,0,1,0,0,0,1,0,0,0,0,0,0,0,1,0,1,0,0,0,0,0
Flower by Kenzo L'Eau Originelle Kenzo for women,1.0,0.0,0.0,1.0,1.0,0.0,1.0,0.0,0,0,0,0,0,0,0,0,0,0,0,0,0,0,1,0,0,0,0,1,0,0,0,0,0,0,0,1,0,0,0,0,0,0,0,0,0,0,0,0,1,1,0,0,0,0,0,1,0,0,0,0,0,0,0,0,0,0,0,0,0,0,0,1,0,0,0,1,0,1,0
Flower by Kenzo L'Elixir Kenzo for women,1.0,0.0,1.0,0.0,0.0,1.0,1.0,1.0,0,0,0,0,0,0,1,0,0,0,0,0,0,0,0,0,0,0,0,1,0,0,0,0,0,0,0,1,0,0,0,0,0,0,0,0,0,0,0,0,0,0,0,0,0,0,0,1,0,0,0,1,0,0,0,1,0,0,0,0,0,0,0,0,0,0,0,0,0,0,0
Flower by Kenzo La Cologne Kenzo for women,1.0,0.0,0.0,1.0,1.0,0.0,1.0,0.0,0,0,0,0,0,0,0,0,0,0,1,0,0,0,0,0,0,0,0,1,0,0,0,0,1,0,0,1,1,0,0,0,0,0,0,0,0,0,0,0,0,0,0,0,0,0,0,0,0,0,0,1,0,0,0,1,0,0,0,0,0,0,0,1,0,0,0,0,0,1,0
Flower by Kenzo Le Parfum Kenzo for women,1.0,0.0,1.0,0.0,0.0,1.0,1.0,1.0,0,0,0,0,0,0,1,0,0,0,0,0,0,0,1,0,0,0,0,0,0,0,0,0,0,0,0,1,0,0,1,0,0,0,0,0,0,0,0,0,0,0,0,0,0,0,0,1,0,0,0,1,0,0,0,1,0,0,0,0,0,0,1,1,0,0,0,0,0,1,0
Flower by Kenzo Oriental Kenzo for women,1.0,0.0,1.0,0.0,0.0,1.0,1.0,1.0,0,0,0,0,0,0,0,0,0,0,1,0,0,0,1,0,0,0,0,0,0,0,0,0,0,0,0,1,0,0,0,0,0,0,0,0,0,0,0,0,1,0,0,0,0,0,1,1,0,0,0,0,0,0,0,1,0,0,0,0,0,1,0,0,0,0,0,0,1,1,0
Flower by Kenzo Poppy Bouquet Couture Edition Kenzo for women,1.0,0.0,0.0,1.0,1.0,1.0,1.0,0.0,0,0,0,0,0,1,1,0,0,0,0,0,0,0,0,0,0,0,0,0,0,0,0,0,0,0,0,0,1,0,0,0,0,0,0,0,0,0,0,0,0,0,0,0,0,0,0,1,1,0,0,0,0,0,0,0,0,1,0,0,0,0,1,0,0,0,0,1,0,1,0
Flower by Kenzo Poppy Bouquet Eau de Parfum Kenzo for women,1.0,0.0,0.0,1.0,1.0,0.0,1.0,0.0,0,0,0,0,0,1,1,0,0,0,0,0,0,0,0,0,0,0,0,0,0,0,0,0,0,0,0,0,1,0,0,0,0,0,0,0,0,0,0,0,0,0,0,0,0,0,0,1,1,0,0,0,0,0,0,0,0,1,0,0,0,0,1,0,0,0,0,1,0,0,0
Flower by Kenzo Poppy Bouquet Eau de Toilette Kenzo for women,1.0,0.0,0.0,1.0,1.0,0.0,1.0,0.0,0,0,0,0,0,0,1,0,0,0,0,0,0,0,0,0,0,0,0,1,0,0,0,0,0,0,0,0,1,0,1,0,0,0,0,0,0,0,0,0,0,0,0,0,0,0,0,1,1,0,0,1,0,0,0,0,0,0,0,0,0,0,1,1,0,0,0,0,0,1,0
Flower by Kenzo Red Edition Kenzo for women,1.0,0.0,0.0,1.0,1.0,1.0,1.0,0.0,0,0,0,0,0,0,0,0,0,0,0,1,0,0,0,0,0,0,0,1,0,0,0,0,0,0,0,1,1,0,0,0,0,0,0,0,0,0,0,0,0,0,0,0,0,0,0,0,0,0,0,1,0,0,0,1,0,0,0,0,1,0,0,1,0,0,0,0,0,1,1
Flower by Kenzo Spring Fragrance Kenzo for women,1.0,0.0,0.0,1.0,0.0,0.0,1.0,0.0,0,0,0,0,0,0,1,0,0,0,0,0,0,0,1,0,0,0,0,1,0,0,0,0,0,0,0,1,0,0,0,0,0,0,0,0,0,0,0,0,1,1,0,0,0,0,0,0,0,0,0,0,0,0,0,0,0,0,0,0,1,0,0,1,0,0,0,0,0,1,0
Flower by Kenzo Summer 2008 Kenzo for women,1.0,0.0,0.0,1.0,0.0,0.0,1.0,0.0,0,0,0,0,0,0,1,0,0,0,0,0,0,0,1,0,0,0,0,1,0,0,0,0,0,0,0,1,0,0,0,0,0,0,0,0,0,0,0,0,1,1,0,0,0,0,0,0,0,0,0,0,0,0,0,0,0,0,0,0,0,0,0,1,0,0,0,0,0,1,0
Flower by Kenzo Summer 2011 Kenzo for women,1.0,0.0,0.0,1.0,1.0,0.0,1.0,0.0,0,0,0,0,0,0,1,0,0,0,0,0,0,0,1,0,0,0,0,1,0,0,0,0,0,0,0,1,0,0,0,0,0,0,0,0,0,0,0,0,1,1,0,0,0,0,0,0,0,0,0,0,0,0,0,0,0,0,0,0,1,0,0,1,0,0,0,1,0,1,0
Flower Ikebana Sakura Kenzo for women,1.0,0.0,0.0,1.0,1.0,1.0,1.0,0.0,0,0,0,0,0,0,0,0,0,0,0,0,0,0,0,0,0,0,0,0,0,0,0,0,1,0,0,1,1,0,0,0,0,0,0,0,0,0,0,0,1,1,0,0,0,0,0,0,0,0,0,0,1,0,0,0,0,1,0,0,0,0,0,0,0,0,0,0,0,1,0
Flower in the Air Kenzo for women,1.0,0.0,0.0,1.0,1.0,0.0,1.0,0.0,0,0,0,0,0,1,1,0,0,0,0,0,0,0,0,0,0,0,0,1,0,1,0,0,0,0,0,1,1,0,0,0,0,0,0,0,0,0,0,0,0,0,0,0,0,0,0,1,0,0,0,1,0,0,0,0,0,0,0,0,0,0,0,1,0,0,0,0,0,1,0
Flower in the Air Eau de Toilette Kenzo for women,1.0,0.0,0.0,1.0,1.0,0.0,1.0,0.0,0,0,0,0,0,0,1,0,0,0,0,0,0,0,0,0,0,0,0,1,0,0,0,0,0,0,0,1,0,0,0,0,0,0,0,0,0,0,0,0,0,0,0,0,0,0,0,1,0,0,0,1,0,0,0,0,0,0,0,0,0,0,0,1,0,0,0,1,0,1,0
Flower in the Air Eau Florale Kenzo for women,1.0,0.0,0.0,1.0,1.0,0.0,1.0,0.0,0,0,0,0,0,0,1,0,0,0,0,0,0,0,0,0,0,0,0,0,0,0,0,0,0,0,0,0,0,0,0,0,0,0,0,0,0,0,0,0,0,1,0,0,0,1,0,1,0,0,0,1,0,0,0,0,0,1,0,0,1,0,0,1,1,0,0,0,0,1,0
Flower in the Air Summer Edition Kenzo for women,1.0,0.0,0.0,1.0,1.0,0.0,1.0,0.0,0,0,0,0,0,0,1,0,0,0,0,0,0,0,0,0,0,0,0,0,0,1,0,0,0,0,0,0,0,0,0,0,0,0,0,0,0,0,0,0,0,1,1,0,0,0,0,1,0,0,0,1,0,0,0,0,0,1,0,0,1,0,0,1,0,0,0,0,0,1,0
Madly Kenzo Oud Collection Kenzo for women,1.0,0.0,1.0,0.0,0.0,1.0,1.0,1.0,0,0,0,0,0,0,0,0,0,0,0,0,0,0,0,0,0,0,0,0,0,1,0,0,0,0,1,1,0,0,0,0,0,0,0,0,0,0,0,1,1,0,0,0,0,0,0,1,0,0,0,0,0,0,0,1,0,0,0,0,0,1,0,0,0,1,0,0,0,1,0
Summer by Kenzo Kenzo for women,1.0,0.0,0.0,1.0,1.0,0.0,1.0,0.0,0,0,0,0,0,0,0,0,0,0,0,0,0,0,0,0,0,0,0,1,0,0,0,0,0,0,0,1,1,0,1,0,0,0,0,0,0,0,0,0,0,1,0,0,0,0,0,0,0,0,0,1,0,0,0,0,0,1,0,0,0,0,0,1,0,0,0,0,0,1,1
Le Chant de Camargue L'Artisan Parfumeur for women and men,1.0,1.0,0.0,1.0,1.0,1.0,1.0,0.0,0,1,0,0,0,1,0,0,0,0,0,0,0,0,0,0,0,0,0,1,0,0,0,0,0,0,0,1,1,0,0,0,0,0,0,0,0,0,0,0,1,1,0,0,0,0,0,0,1,0,0,0,0,0,0,0,0,1,0,0,0,0,0,0,0,0,0,0,0,1,0
Miracle Lancôme for women,1.0,0.0,0.0,1.0,1.0,0.0,1.0,0.0,0,0,0,0,0,0,1,0,0,0,1,0,0,0,0,0,0,0,0,1,0,0,0,0,0,0,0,0,1,0,0,0,0,0,0,0,0,0,0,0,1,1,0,0,0,0,0,0,0,0,0,0,0,0,0,0,0,0,0,0,1,0,0,1,0,0,0,0,0,1,0
Miracle Tendre Voyage Lancôme for women,1.0,0.0,0.0,1.0,1.0,0.0,1.0,0.0,0,0,0,0,0,0,0,0,0,0,0,0,0,0,1,0,0,0,0,1,0,0,0,0,0,0,0,1,0,0,0,0,0,0,0,0,0,0,0,0,0,1,0,0,0,0,0,1,0,0,0,0,0,0,0,0,0,1,0,0,0,0,0,1,0,0,0,0,0,1,0
Lanvin L'Homme Lanvin for men,0.0,1.0,0.0,1.0,1.0,0.0,1.0,0.0,0,0,0,0,0,0,0,0,0,0,1,0,0,0,0,0,0,0,0,1,1,0,0,0,1,0,0,1,0,0,0,0,0,0,0,0,0,0,0,0,1,0,0,0,0,0,0,0,1,0,0,0,0,0,1,0,0,1,0,0,0,0,0,1,0,0,0,0,0,0,0
Oxygene Lanvin for women,1.0,0.0,0.0,1.0,1.0,0.0,1.0,0.0,0,0,0,0,0,1,0,0,0,0,1,0,0,0,1,0,0,0,0,1,0,0,0,0,0,0,0,1,1,1,0,0,0,0,0,0,0,0,0,0,1,0,0,0,0,0,0,0,0,0,0,0,0,0,0,0,0,1,0,0,0,0,0,1,0,0,0,0,0,0,0
Oxygene Homme Lanvin for men,0.0,1.0,0.0,1.0,1.0,0.0,1.0,0.0,0,0,0,0,0,0,0,0,0,0,1,0,0,0,0,0,0,0,0,0,0,0,0,0,1,0,0,0,0,0,0,0,0,0,0,0,0,0,0,0,0,0,0,0,0,0,0,0,0,0,0,0,0,0,1,0,0,1,0,0,0,0,0,0,0,0,0,0,0,0,0
Tubereuse 40 New York Le Labo for women and men,1.0,1.0,0.0,1.0,1.0,0.0,1.0,0.0,0,0,0,0,0,0,0,0,0,0,1,0,0,0,0,0,0,0,0,1,0,0,0,0,1,0,0,0,1,0,0,0,0,0,0,0,0,0,0,0,0,0,0,0,0,0,0,0,1,0,0,1,1,0,0,0,0,1,0,0,0,0,0,0,0,0,0,0,0,1,0
Vanille 44 Paris Le Labo for women and men,1.0,1.0,1.0,0.0,0.0,1.0,1.0,1.0,0,0,0,0,0,0,0,0,0,0,0,0,0,0,0,0,0,0,0,1,0,0,0,0,0,0,0,1,0,0,0,0,0,0,0,0,0,0,0,0,1,0,0,0,0,0,1,0,0,0,0,1,0,0,0,1,0,1,0,0,0,1,0,0,1,0,0,0,1,0,0
Esencia Femme Loewe for women,1.0,0.0,1.0,1.0,0.0,1.0,1.0,1.0,0,0,0,0,0,0,0,0,0,0,1,0,0,0,0,0,0,0,0,1,0,0,0,0,0,0,0,1,0,0,0,0,0,0,0,0,0,0,0,0,1,0,0,0,0,0,0,1,1,0,0,1,0,0,0,0,0,1,0,0,0,0,0,1,0,0,0,0,0,1,0
Lotus Fraiche Lotus for men,0.0,1.0,0.0,1.0,1.0,0.0,1.0,1.0,0,0,0,0,0,0,0,0,0,0,1,0,0,0,0,0,0,0,0,1,0,0,0,0,0,0,0,0,1,0,0,0,0,0,0,0,0,0,0,0,0,1,0,0,0,0,0,0,0,0,0,0,0,0,0,0,0,1,0,0,0,0,0,0,0,0,0,0,0,1,0
Lotus Intense Lotus for women and men,1.0,1.0,1.0,1.0,1.0,1.0,1.0,1.0,0,0,0,0,0,0,0,0,0,0,1,0,0,0,0,0,0,0,0,1,0,0,0,0,1,0,0,0,0,0,0,1,0,0,0,0,0,0,0,1,1,1,0,0,0,0,0,0,0,0,0,0,0,0,0,0,0,1,0,0,0,1,0,0,0,1,0,0,0,0,0
Lotus Oud Lotus for women and men,1.0,1.0,1.0,1.0,1.0,1.0,1.0,1.0,0,0,1,0,0,0,0,0,0,0,0,0,0,0,0,0,0,0,0,0,0,0,0,0,1,0,1,1,0,0,0,0,0,0,0,0,0,0,0,0,1,0,0,0,0,0,0,0,0,0,0,1,0,0,0,1,0,1,0,0,0,1,0,0,0,0,0,0,1,0,0
Daisy Marc Jacobs for women,1.0,0.0,0.0,1.0,1.0,0.0,1.0,0.0,0,0,0,0,0,0,1,1,0,0,0,0,0,0,1,0,0,0,0,1,0,0,0,0,0,0,0,1,1,0,0,0,0,0,0,0,0,0,0,0,0,0,0,0,0,0,0,0,0,0,0,1,0,0,0,0,0,1,0,0,0,0,0,1,0,0,0,1,0,0,0
Daisy 10th Anniversary Edition Marc Jacobs for women,1.0,0.0,0.0,1.0,0.0,0.0,1.0,0.0,0,0,0,0,0,0,1,1,0,0,0,0,0,0,1,0,0,0,0,1,0,0,0,0,0,0,0,1,1,0,0,0,0,0,0,0,0,0,0,0,0,0,0,0,0,0,0,0,0,0,0,1,0,0,0,0,0,1,0,0,0,0,0,0,0,0,0,1,0,1,0
Daisy 10th Anniversary Luxury Edition Marc Jacobs for women,1.0,0.0,0.0,1.0,0.0,0.0,1.0,0.0,0,0,0,0,0,0,1,1,0,0,0,0,0,0,1,0,0,0,0,0,0,0,0,0,0,0,0,1,1,0,0,0,0,0,0,0,0,0,0,0,0,1,0,0,0,0,0,0,1,0,0,1,0,0,0,0,0,0,0,0,0,0,0,0,0,0,0,1,0,1,0
Daisy Anniversary Edition Marc Jacobs for women,1.0,0.0,0.0,1.0,1.0,0.0,1.0,0.0,0,0,0,0,0,0,1,1,0,0,0,0,0,0,1,0,0,0,0,1,0,0,0,0,0,0,0,1,1,0,0,0,0,0,0,0,0,0,0,0,0,0,0,0,0,0,0,0,0,0,0,1,0,0,0,0,0,1,0,0,0,0,0,1,0,0,0,1,0,0,0
Daisy Black Edition Marc Jacobs for women,1.0,0.0,0.0,1.0,1.0,0.0,1.0,0.0,0,0,0,0,0,0,1,1,0,0,0,0,0,0,1,0,0,0,0,1,0,0,0,0,0,0,0,1,1,0,0,0,0,0,0,0,0,0,0,0,0,0,0,0,0,0,0,0,0,0,0,1,0,0,0,0,0,1,0,0,0,0,0,1,0,0,0,1,0,0,0
Daisy Daze Marc Jacobs for women,1.0,0.0,0.0,1.0,1.0,0.0,1.0,0.0,0,0,0,0,0,0,1,0,0,0,0,0,0,0,0,0,0,0,0,1,0,0,0,0,0,0,0,1,0,0,0,0,0,0,0,0,0,0,0,0,0,0,0,0,0,0,0,0,0,0,0,1,0,0,0,0,0,0,0,0,0,0,0,1,0,0,0,0,0,0,0
Daisy Dream Marc Jacobs for women,1.0,0.0,0.0,1.0,1.0,0.0,1.0,0.0,0,0,0,0,0,0,1,0,0,0,1,0,0,0,0,0,0,0,0,1,0,0,0,0,0,0,0,0,1,0,0,0,0,0,0,0,0,0,0,0,0,1,0,0,0,0,0,0,0,0,0,1,0,0,0,0,0,0,0,0,1,0,0,1,0,0,0,1,0,1,0
Daisy Dream Daze Marc Jacobs for women,1.0,0.0,0.0,1.0,1.0,0.0,1.0,0.0,0,0,0,0,0,0,1,0,0,0,1,0,0,0,0,0,0,0,0,0,0,0,0,0,0,0,0,1,0,0,0,0,0,0,0,0,0,0,0,0,0,1,0,0,0,0,0,0,0,0,0,1,0,0,0,0,0,0,0,0,0,0,0,1,0,0,0,0,0,1,0
Daisy Dream Forever Marc Jacobs for women,1.0,0.0,0.0,1.0,1.0,0.0,1.0,0.0,0,0,0,0,0,0,1,0,0,0,0,0,0,0,0,0,0,0,0,0,0,0,0,0,0,0,0,0,1,0,0,0,0,0,0,0,0,0,0,0,0,1,0,0,0,0,0,0,0,0,0,1,0,0,0,0,0,0,0,0,1,0,0,0,0,0,0,0,0,1,0
Daisy Dream Petals Marc Jacobs for women,1.0,0.0,0.0,1.0,1.0,0.0,1.0,0.0,0,0,0,0,0,0,1,0,0,0,1,0,0,0,0,0,0,0,0,1,0,0,0,0,0,0,0,0,0,0,0,0,0,0,0,0,0,0,0,0,0,1,0,0,0,0,0,0,0,1,0,1,0,0,0,0,0,0,0,0,1,0,0,0,0,0,0,0,0,1,0
Daisy Dream Sunshine Marc Jacobs for women,1.0,0.0,0.0,1.0,1.0,0.0,1.0,0.0,0,0,0,0,0,0,1,0,0,0,0,0,0,1,0,0,0,0,0,1,0,0,0,0,0,0,0,1,1,0,0,0,0,0,0,0,0,0,0,0,0,0,0,0,0,0,0,0,0,0,0,1,0,0,0,0,0,0,0,0,0,0,0,1,1,0,0,0,0,0,0
Daisy Eau So Fresh Daze Marc Jacobs for women,1.0,0.0,0.0,1.0,1.0,0.0,1.0,0.0,0,0,0,0,0,0,1,0,0,0,0,0,0,0,0,0,0,0,0,0,0,0,0,0,0,0,0,0,0,0,0,0,0,0,0,0,0,0,0,0,0,0,0,0,0,0,0,0,0,0,0,1,0,0,0,0,0,0,0,0,0,0,0,0,0,0,0,0,0,1,0
Daisy Eau So Fresh Paradise Limited Edition Eau de Toilette Marc Jacobs for women,1.0,0.0,0.0,1.0,1.0,0.0,1.0,0.0,0,0,0,0,0,0,0,0,0,0,0,0,0,0,0,0,0,0,0,0,1,1,0,0,1,0,0,0,0,0,0,0,0,0,0,0,0,0,0,0,0,0,0,0,0,0,0,0,0,0,0,0,0,0,0,0,0,1,0,0,0,0,0,0,0,0,0,0,0,1,0
Daisy Eau So Fresh Petals Marc Jacobs for women,1.0,0.0,0.0,1.0,1.0,0.0,1.0,0.0,0,0,0,0,0,0,1,0,0,0,0,0,0,0,1,0,0,0,0,1,0,0,0,0,0,0,0,1,0,0,0,0,0,0,0,0,0,0,0,0,0,1,0,0,0,0,0,0,1,0,0,1,0,0,0,0,0,1,0,0,0,0,0,1,0,0,0,0,0,1,0
Daisy Eau So Fresh Skies Marc Jacobs for women,1.0,0.0,0.0,1.0,1.0,0.0,1.0,0.0,0,0,0,0,0,0,0,0,0,0,0,0,0,0,1,0,0,0,0,0,0,0,0,0,1,0,0,1,0,0,0,0,0,0,0,0,1,0,0,0,0,0,0,0,0,0,0,0,1,0,0,1,0,0,1,0,0,1,0,0,0,0,0,1,0,0,0,0,0,1,0
Daisy Eau So Fresh Spring Marc Jacobs for women,1.0,0.0,0.0,1.0,1.0,0.0,1.0,0.0,0,0,0,0,0,0,0,0,0,0,0,0,0,0,0,0,0,0,0,0,0,0,0,0,0,0,0,1,0,0,0,0,0,0,0,0,0,0,0,0,0,0,0,0,0,0,0,0,1,0,0,0,0,0,0,0,0,0,0,0,0,0,0,0,0,0,0,0,0,0,0
Daisy Eau So Fresh Sunshine Marc Jacobs for women,1.0,0.0,0.0,1.0,1.0,0.0,1.0,0.0,0,0,0,0,0,0,1,0,0,0,0,0,0,0,0,0,0,0,0,0,0,1,0,0,1,0,0,1,0,0,0,0,0,0,0,0,0,0,0,0,0,1,0,0,0,0,0,0,1,0,0,1,0,0,0,0,0,0,0,0,0,0,0,0,0,0,0,1,0,1,1
Daisy Eau So Intense Marc Jacobs for women,1.0,0.0,0.0,1.0,1.0,1.0,1.0,0.0,0,0,0,0,0,0,1,0,0,0,0,0,0,0,0,0,0,0,0,0,0,0,1,0,0,0,0,1,1,0,0,0,0,0,0,0,0,1,0,0,0,0,0,0,0,0,0,0,0,0,0,1,0,0,0,1,0,0,0,0,0,1,0,1,0,0,0,0,0,1,0
Daisy Garland Marc Jacobs for women,1.0,0.0,0.0,1.0,1.0,0.0,1.0,0.0,0,0,0,0,0,0,0,0,0,0,0,0,0,0,1,0,0,0,0,0,0,0,0,0,0,0,0,1,0,0,0,0,0,0,0,0,0,0,0,0,0,0,0,0,0,0,0,0,0,0,0,0,0,0,0,0,0,0,0,0,0,0,0,0,0,0,0,0,0,1,0
